tweet,category,cluster,cause,sentiment,sentiment_score,user_id,user_screen_name,user_followers_count,user_friends_count,user_favourites_count,influence_ratio,user_statuses_count,user_verified,user_description,user_category
RT of The wigs that judicial officials wear today were invented in the with century To cover the boldness of syphilis http,educational,"Other communicable, maternal, neonatal, and nutritional disorders",Syphilis,neutral,0,2174997891,jibluski,230,733,7764,0.31,5529,0,$,public
Remembering Life Saw s Influence on Lip Top The Tribe Called Guest exceed died from complications resulting from diabetes,educational,,Diabetes,negative,-0.608171,731463242,Ariielis,464,247,421,1.87854251,227969,0,( 02.07.2000 Julio #Canceriana ( 15 A\xf1os ),public
FlashBack Malaria Drugs Provides Novel CURE For Cancer,educational,,Malaria,negative,-0.706241,3378567220,tcpmultimedia,581,1451,21,0.400413508,28172,0,( Ayo Mojoyin ). General Exclusive News Reporting From All Genres Of Life Both Local And International . Brand Promotions And Product Activation .,public
SBAList That Happened to Safe Legal amp Are Abortion Today Is about Profit Profit,personal,,Abortion,negative,-0.61165,109383034,BabyDoeBook,281,226,7,1.24,7720,0,"(#Messages of #Hope, #Love, and #Forgiveness) #Prolife #BabyDoe #PrayToEndAbortion #tcot #Stand4Life #March4Life #Fiction",public
Today just makes me want to cry bc I m drowning in stress,personal,,Drowning,negative,-0.902595,570516312,BroMyNamesLayla,360,525,2443,0.685714286,7602,0,(not my president),public
RT of Recreational marijuana Use and acute ischaemic stroke A population based analysis of hospitalized patients in the http,educational,Cardiovascular and circulatory diseases,ischemic stroke,neutral,0,49307186,Colaborattus,1396,1960,1841,0.712,41656,0,"*Aplica teu cora\xe7\xe3o \xe0 instru\xe7\xe3o e teus ouvidos \xe0s palavras da ci\xeancia*Pr 23,12*",public
By And is suffering from Diabetes pus let us know the tips to control and Obesity ThankYou,educational,,Diabetes,negative,-0.818895,59365525,EkBalakAlag,359,1298,335,0.277,3586,0,*Ashanti*\u251cSince 1991\u251c Stupid\u2666Free\u2666Fully Indian \u2666Mumbaikar\u2666Marathi\u2666|| Food-Junkie\u25d8 Photography\u25d8Dreamer !,public
mob The economy alone can give that Malaria symptoms,unrelated,,Malaria,negative,-0.733463,3346396407,lizzylad93,997,530,420,1.881132075,35453,0,. silhouette .\nPYT\u2642,public
I applied for the asthma one too testing inhaled hopefully they accept me can t be that bad,personal,,Asthma,negative,-0.891247,280411203,ColeRigby,578,937,889,0.62,2118,0,.. too blessed to be stressed sista,public
STDs don t even carry much weight these days He have too many communicable diseases to worry about,educational,"Other communicable, maternal, neonatal, and nutritional disorders",STDs,negative,-0.912916,2362323581,Neuro_king_,983,642,145,1.53,49958,0,...Spawn of ZEUS...,public
Pandemonium blood flow as banker falls in popular area of Ago photo,educational,,Falls,negative,-0.798004,2786556777,ope2y,1894,4194,71,0.45159752,24869,0,"...with full sense of responsibility,working together with like and unlike minds brings progress, partnership and productivity...",public
RT of More Childhood Leukaemia Foundation KCLF webster update Hanging,educational,Neoplasms,Leukemia,positive,0.243962,312491158,Modchaya,3133,231,3423,13.56,214123,0,.\u0e08\u0e38\u0e14\u0e40\u0e23\u0e34\u0e48\u0e21\u0e15\u0e49\u0e19\u0e17\u0e35\u0e48\u0e44\u0e21\u0e48\u0e21\u0e35\u0e08\u0e38\u0e14\u0e08\u0e1a \u0e40\u0e21\u0e37\u0e48\u0e2d\u0e44\u0e14\u0e49\u0e1e\u0e1a\u0e01\u0e31\u0e1a Super  junior \u2764,public
RT of A new Kentucky bill would require men to get consent from their spouse before using Diagram,educational,Maternal disorders,Abortion,positive,0.393402,120844922,thekidremy,156,106,1088,1.47,8592,0,"//#xb1 GT: Roflremy // #CudLife // 803,407,714 // @Alyyxisss \u2764 \ufe0f//",public
RT of Siberia is always like a season film 1 Obasanjo Iv Lids 2 War Due Bird fly 3 Jonathan Bold 4 Buhari L,unrelated,Neglected tropical diseases and malaria,ebola,positive,0.323339,3683285593,spunky1_,53,570,768,0.09,950,0,@anthonyair_,public
game falls asleep,unrelated,,Falls,negative,-0.801547,3268769947,scalpelstar,237,84,59,2.821428571,1787,0,@AZRobbinsPaeds is my Happily Ever After [descriptive roleplay/18+/AU],public
walls thanks falls xx,unrelated,Unintentional injuries other than transport injuries,Falls,neutral,0,157102824,amymcmanus_,1475,970,16007,1.52,28148,0,@callumrodger1 \u2764\ufe0f,public
Recruiting for triple negative breast cancer survivor Join our surveillance clinical program,educational,Neoplasms,Breast cancer,negative,-0.840253,48404097,andredefusco,178,331,1,0.538,122,0,@cynvenio CEO - pioneering LiquidBiopsy & tumor cell sequencing to improve cancer outcomes. Live long and prosper.,public
anyway here s harry drowning in men,personal,,Drowning,negative,-0.645796,7.22E+17,tempourarylarry,0,44,0,0,1,0,@fadingtmh,public
anyway here s harry drowning in men,personal,,Drowning,negative,-0.645796,7.22E+17,tempourarylarry,0,44,0,0,1,0,@fadingtmh,public
I have such a bad migrate in going to bed,personal,,Migraine,negative,-0.802132,7.37E+17,gillettexhes,4,24,1,0.17,3,0,@hxsrevival,public
give had 10 series today safe to say i have diabetes and i need to go home,unrelated,,Diabetes,negative,-0.726104,1659416455,akbar_rahmani,568,422,10059,1.345971564,21208,0,@josiekbruwer // you fool. you absolute buffoon.,public
Men should not really get to decide laws about abortion,personal,,Abortion,negative,-0.697172,635162773,gucci_cel,1124,637,70117,1.764521193,40107,0,@LesAnn00 | Victor,public
this is random but I hope Kaelyn s lawton doesn t just overhead and die every night after she falls asleep on us org,personal,,Falls,negative,-0.844458,7.37E+17,kuhlsivan,6,77,0,0.077922078,0,0,@letheloveremain,public
this is random but I hope Kaelyn s lawton doesn t just overhead and die every night after she falls asleep on us org,personal,,Falls,negative,-0.844458,7.37E+17,kuhlsivan,6,77,0,0.08,0,0,@letheloveremain,public
RT of pus of Meningitis vaccines for all children could have saved Aye X menbvaccin,educational,"Diarrhea, lower respiratory infections, meningitis, and other common infectious diseases",Meningitis,negative,-0.675252,38711252,HazelWilliams_2,147,424,2844,0.347,2859,0,"@LoveableRogues tweeted me:)  19 years old, born with hydrocephalus and meningitis, wanting to spread awareness of the diseases no matter how hard it is.",public
own bitter will i get diabetes if i put sugar,personal,,Diabetes,negative,-0.769382,7.16E+17,MCDCTY,35,28,49,1.25,2295,0,@MCD4DDY dm for contact. I will be back when I am less busy,public
I had these on for like 10 minutes amp have had a migrate ever since They will be returned,personal,,Migraine,neutral,0,35757101,tastemyrizzo,1601,2307,16630,0.694,59127,0,"@MindTheBass - Chimaira loyalist - I \u2764 wrestling, Star Wars, Jason Voorhees, used books, horror flicks, Kanye West, NY Giants, guacamole, brunch, & comic books",public
I m honestly such a bitch when I have a migrate amp I feel so bad,personal,Neurological disorders,Migraine,negative,-0.9054,262026361,leksi_xoxo,1037,472,17413,2.2,15719,0,"@N_Elsen18 \u2764\ufe0f | drink water, eat burgers, relax | for my angels Vidosava & Bruno\u2764\ufe0f",public
this migrate is making this way worse,personal,,Migraine,negative,-0.765724,2903945382,jennsanss,435,243,5070,1.790123457,17151,0,@otfky,public
what bout like self harm stuff,personal,,Self-harm,negative,-0.201863,7.08E+17,Rickyscolorful,177,610,1884,0.29,215,0,@RickyPDillon @TrevorMoran RICKY FOLLOWED ME 3/25/16 Ricky retweeted my tweet 3/27/16!!!!MY LIFE CHANGED WHEN I MET BAES ON 3/9/16,public
Epidemic of MDR Tuberculosis amp keratitis are rising in all besieged areas in Syria especially Shouts Some,educational,"Other communicable, maternal, neonatal, and nutritional disorders",Hepatitis,negative,-0.859757,33806698,sahloul,8162,4656,252,1.753,21161,0,@SAMSGlobalR #American Relief Coalition for #Syria @sams_usa #Humanitarian #Relief #Refugees #Medicine #HumanRights #interfaith #CriticalCare Views are my own,public
Study Full fat dairy may help curb weight gain diabetes healthyeating milk,educational,,Diabetes,negative,-0.71625,4899784743,ChristinaCanvin,479,1151,139,0.416159861,945,0,@SterreHealth we believe #oralhealth is critical to overall health #Oral7,interest groups
To just bc this bitch trips and falls it s a foul on of I m done They re giving Kansas this game,unrelated,,Falls,negative,-0.804113,246570921,DRuzzell,478,174,5206,2.75,17023,0,@SydneyEmerson_ is my queen ! ;),public
lorncoil throwback to when i got foot ebook and canceled a trip around europe,unrelated,Neglected tropical diseases and malaria,ebola,negative,-0.359327,288678547,ROBBOsickdog,4516,555,4472,8.14,45785,0,"@Twitch Partner with over 30,000 followers - Oldschool Runescape Player - @OblivionPVM - My discord - https://t.co/MhT2vQFmN9",public
now advocating offshore processing in Malaysia is that another idea boom eusol,educational,,Abortion,positive,0.307002,3943447392,Left_of_Labor,3062,863,9998,3.55,22419,0,"@TwitterWomen. Netball, Farmer, Married, Oz-Leftie, Equal Rights, Support ALP #UNHCR refugee policy. #Greens are sell outs & hypocrites. Only #Labor can Govern.",public
Entomologist Helps Clock Genetic Secret that Would Help Right Malaria and Like Virus,educational,,Malaria,positive,0.638272,40988356,seannealon,611,615,84,0.993,1903,0,@UCRiverside science and agriculture news. Contact: sean.nealon@ucr.edu.,media
Today in new potential anti malaria drug selective target parasite s proteasome,educational,Neglected tropical diseases and malaria,Malaria,negative,-0.514695,270973889,HeatherBuschman,736,595,92,1.24,2266,0,"@UCSanDiego PhD in Molecular Pathology, @WPI alum, science writer at @UCSDHealth. Views here my own, RT\u2260endorsement",public
hi be the failed abortion,unrelated,,Abortion,negative,-0.480634,7.68E+17,zisowned,0,0,0,0,2,0,@zisowned,public
RT of MeningitisOutbreak That you need to know and do all here,educational,"Diarrhea, lower respiratory infections, meningitis, and other common infectious diseases",Meningitis,neutral,0,305532466,kobbyblay,2080,1422,2206,1.46,21136,0,"[Restive by nature] Nurse, Award winning #HealthBlogger/Health Editor @HealthNestgh, Lead @EbolaGh, #HCSMgh & #Nursenality |  #Nikon Travel Photographer",businesses
of LIKED of TWEET of LIKED of TWEET in creaked so loud my am thought I was having a asthma attack I LOVE YOU TOBY,personal,,Asthma,positive,0.755877,7.15E+17,qxeen_Txyin,353,350,3648,1.01,2560,0,[Sdmn] [Chip]\n[Freezy] [Lux],public
RT of When or girl falls out with her J bag friend so u add bare fuel to the fire like rah she said that I would delete her from,unrelated,Unintentional injuries other than transport injuries,Falls,negative,-0.773252,255442787,kimxbeau,5141,1376,55897,3.74,60053,0,\U0001f1ef\U0001f1f2\U0001f1ec\U0001f1e7,public
The way my sum falls asleep is ridiculous we were just talking now she s checking up them zZzZz s,unrelated,,Falls,negative,-0.5033,106793434,kingxrealz,1192,608,29291,1.960526316,138663,0,\U0001f1ff\U0001f1f2 | 23 \U0001f3f3\ufe0f\u200d\U0001f308 | PLA Life | Poet | Undergrad \U0001f393 | M.J.S - 11/08/16 \U0001f49b | #BlackLivesMatter | Rest In Power Bervil (Knight Vercetti)\U0001f54a\U0001f499,public
i bet when they are staying at hotels after everyone falls asleep tyler creep over to wishes bed and gets in with him,unrelated,,Falls,negative,-0.679904,3098296905,regionaljoseph,4325,91,80414,47.52747253,33217,0,\U0001f3f3\ufe0f\u200d\U0001f308\U0001f4e2,public
7 30 class and I just woke up fearing asthma attack,personal,Chronic respiratory diseases,Asthma,negative,-0.609154,129419637,jayyvillacortss,885,514,4826,1.72,50181,0,\U0001f427,public
Stared and judged this guy for drowning his food in salt and then he made eye contact with me,personal,,Drowning,negative,-0.31627,150344125,ToeKnee_Win,230,1095,1308,0.21,2806,0,\U0001f47b: toeknee_win,public
His migrate needs to go,personal,Neurological disorders,Migraine,negative,-0.422306,60110067,manthapantss,192,106,190,1.811,6617,0,\U0001f47b:Manthapantss. MastersBound. HisQueen. Fit Mom. BossLady. TattooedGirlyGirl. \u2764\ufe0f,public
I am like 78 sure it contains condensed milk so he s probably got type 2 diabetes now,personal,,Diabetes,negative,-0.428785,163980407,Louise_VJ,521,1106,2528,0.47,9920,0,\U0001f4f8: lou.se,public
sweet cut ok And you still gutta meet Sky she s 10 now,unrelated,,Falls,positive,0.390876,117608805,NYagara_falls,1520,1034,709,1.47,128245,0,\U0001f4f8: nyagara.falls   \U0001f47b : nyagara_falls,public
RT of 15 Times Breast Cancer Scars Were Transformed Into Awesome Tattoo,educational,Neoplasms,Breast cancer,positive,0.345654,277129407,Epea_pteroenta,1405,1280,14007,1.1,15659,0,\u03a6\u0395\u0393\u0393\u0391\u03a1\u039f\u039b\u039f\u03a5\u03a3\u039c\u0395\u039d\u0397,public
of Sweet Hills the horrors of diabetes in glossy pictures,educational,,Diabetes,neutral,0,318355178,CurrentSocials,2677,111,145,24.12,737549,0,"\u03b9 \u2113\u0e4fv\u0aef \u043cy h\u03b1\u0ab0\u2113\u0aefy ... b\u0aef\u03b1ch\u0aef\u0e23 ... \u03b1\u03b7\u2202 \u0e4f\u0192 c\u0e4f\u03c5\u0ab0\u0e23\u0aef, \u043c\u03c5\u0e23\u03b9c! y\u0e4f\u03c5 c\u03b1\u03b7 \u03b7\u0aefv\u0aef\u0ab0 b\u0aef \u0e4f\u2113\u2202 \u03b1\u03b7\u2202 \u03c9\u03b9\u0e23\u0aef \u03b9\u0192 y\u0e4f\u03c5 \u03c9\u0aef\u0ab0\u0aef \u03b7\u0aefv\u0aef\u0ab0 y\u0e4f\u03c5\u03b7g \u03b1\u03b7\u2202 c\u0ab0\u03b1zy! \u2707",public
of Sweet Hills the horrors of diabetes in glossy pictures,educational,,Diabetes,neutral,0,318355178,CurrentSocials,2677,111,145,24.11711712,737549,0,"\u03b9 \u2113\u0e4fv\u0aef \u043cy h\u03b1\u0ab0\u2113\u0aefy ... b\u0aef\u03b1ch\u0aef\u0e23 ... \u03b1\u03b7\u2202 \u0e4f\u0192 c\u0e4f\u03c5\u0ab0\u0e23\u0aef, \u043c\u03c5\u0e23\u03b9c! y\u0e4f\u03c5 c\u03b1\u03b7 \u03b7\u0aefv\u0aef\u0ab0 b\u0aef \u0e4f\u2113\u2202 \u03b1\u03b7\u2202 \u03c9\u03b9\u0e23\u0aef \u03b9\u0192 y\u0e4f\u03c5 \u03c9\u0aef\u0ab0\u0aef \u03b7\u0aefv\u0aef\u0ab0 y\u0e4f\u03c5\u03b7g \u03b1\u03b7\u2202 c\u0ab0\u03b1zy! \u2707",public
Two Walls and a Little Fool by T Patrick O Vara,unrelated,,Falls,negative,-0.336321,108108152,SNikolaevic,990,975,76,1.02,7545,0,"\u0416\u0438\u0432\u0443 \u043d\u0430 \u0423\u043a\u0440\u0430\u0438\u043d\u0435 \u0432 \u041b\u0443\u0433\u0430\u043d\u0441\u043a\u043e\u0439 \u043e\u0431\u043b\u0430\u0441\u0442\u0438, \u0432\u0435\u0440\u0443\u044e\u0449\u0438\u0439, \u0436\u0435\u043d\u0430\u0442 \u0438\u043c\u0435\u044e \u0434\u0435\u0442\u0435\u0439, \u043b\u044e\u0431\u043b\u044e \u0411\u043e\u0433\u0430.",public
RT of His month I m joining and their partnership with the Alzheimer s Association,personal,Neurological disorders,Alzheimer,negative,-0.602797,1196881394,diedforspice,1003,224,2217,4.48,116272,0,\u0442\u0443\u0442 \u043d\u0435\u0442 \u043d\u0438\u0447\u0435\u0433\u043e \u043a\u0440\u043e\u043c\u0435 \u0434\u0435\u043f\u0440\u0435\u0441\u0441\u0438\u0438,public
Article reviews the role of risk reducing surgery in hereditary breast and ovarian cancer,educational,Neoplasms,Ovarian cancer,negative,-0.777501,44727893,EHABKHATAB,77,650,500,0.118,2232,0,\u0637\u0628\u064a\u0628 \u0627\u0645\u0631\u0627\u0636 \u0627\u0644\u0646\u0633\u0627\u0621 \u0648 \u0627\u0644\u062a\u0648\u0644\u064a\u062f\r\nOBSTETRICIAN AND GYNECOLOGIST.,public
I added a video to a playlist Crazy Down Frowning of,unrelated,,Drowning,negative,-0.845799,59593286,kymoDragon,246,486,2703,0.506,23482,0,\u06e9  }o{{19}}---^     Kim Marie Ostrowski  \nhttps://t.co/qDTYOuI4ho\u2026\n https://t.co/2VqlAJacx7\u2026 \nhttps://t.co/0dQlWJIXIM\nhttps://t.co/NOfrxnfEB1\u2026,public
literally nobody is searching twitter for please drowning in hashtags,unrelated,,Drowning,negative,-0.731599,283271788,riking27,309,298,19997,1.04,9756,0,"\u2013 i write programs \u2013 available for work \u2013 @FrankerFaceZ, @letsencrypt, @Discourse, @mcmmo_Dev \u2013 alt @riking27loud \u2013",public
RT of AIDS is the leading cause of death of 25 34 year old black women,educational,HIV/AIDS and tuberculosis,HIV/AIDS,negative,-0.605706,35860455,TurntableKittah,2775,5001,166799,0.555,145945,0,"\u201cI don\u2019t mean you\u2019re all going to be happy. You\u2019ll be unhappy \u2013 but in new, exciting and important ways.\u201d \u2013 Edwin Land\n \U0001f427\U0001f3ce\U0001f4fd\U0001f4f2\U0001f4ca",public
Now do you put HIV AIDS in a banana,educational,,HIV/AIDS,neutral,0,131598477,THEPUNllSHER,2211,379,65520,5.83,71657,0,\u2022 #ALLBLACKLIVESMATTER \u262d,public
God still loves that person who had an abortion so I don t understand,personal,,Abortion,neutral,0,148487105,patienceadu_,2203,884,2872,2.492081448,47794,0,\u2022 @EliandPai Clothing Line \u2022 Finance undergrad \u2022 snap: patienceadupoku \u2022 Saved By Grace \u2022 @Hearts_Alight \u2022,businesses
He just looked at me and said save my baby Hero who rescued infant in pier drowning tragedy,personal,,Drowning,neutral,0,982807459,CaitlynnPatrick,218,155,526,1.406451613,4375,0,"\u2022 Est \u2022 1998 \u2022 Fifteen \u2022 Women should be two things, Classy and fabulous | Coco Chanel \u2022",public
oh yeah since u don t have the energy to go out yet do take a lot of rest and I hope it wont lead to malaria,personal,,Malaria,negative,-0.734369,135499345,FYsqa,118,136,29085,0.867647059,30069,0,\u2022 Foreign Swagger \u2022,public
RT of Multiple Myeloma Research Foundation can use our help All support s race to help patients like his Tom,educational,Neoplasms,Multiple myeloma,positive,0.825662,4760972659,twi_db,155,472,1957,0.33,3285,0,\u2022I love Justin Bieber\u2022\u2665\ufe0f\u2022PROPUSE \u2022\u2665\ufe0fWorld be prepared #Propuseworldtour\u2665\ufe0f,public
what webster did you use for the cardiomyopathy paper,unrelated,Cardiovascular and circulatory diseases,Cardiomyopathy,negative,-0.286568,270581665,KelsiWilliams3,998,838,12918,1.19,21351,0,"\u2022Ohio University                                                              \u2022Every story has an ending, but in life, endings are just beginnings.",public
His migrate is never ending,personal,,Migraine,negative,-0.334968,319830369,SoleilVThompson,1911,896,5789,2.13,15318,0,\u2022surround yourself with peace and positivity\u2022,public
Fro Abortion Writer Twists Scripture to Claim Jesus Would Want Little Sisters to Promote Abortion,educational,,Abortion,neutral,0,2892360850,DarenStoic,1493,1213,3840,1.230832646,63108,0,\u2626\ufe0f Truth is hate for those that hate the truth. Work brings Freedom. \U0001f438 #Orthodox #Traditionalist #Nationalist #StopIslam #ICC4Israel #SmashCulturalMarxism,public
When food goes down the wrong pipe I can now only think ASPIRATION PNEUMONIA ll,personal,,pneumonia,negative,-0.811484,311160382,ashleybelly,368,175,688,2.1,29293,0,\u2649; Licensed Massage Therapist; Sarcastic; on the right path,public
I however didn really know what was going on so my grand that was half paralyzed because of a stroke had breast cancer,personal,,Breast cancer,negative,-0.902472,7.05E+17,Cody_Loves_Hugs,46,64,0,0.71875,28,0,"\u2661Kaylee\u2665 Deadpool,TMNT,Adventure Time,Crystal Jems, Call Of Duty, are all things I like especially. ... HUGS!!",public
his campaign is getting worse and worse until it falls over the cliff,unrelated,,Falls,negative,-0.925042,119323247,SOUTHERNjamespb,3575,2972,7380,1.202893674,115563,0,"\u2665#MensFashion, #Arts, #Spirituality, #Numerology, #Astrology, #HealthAndWellness \u2665     *Note: RT \u2260 ENDORSEMENT.*",interest groups
same hata I like pretty doctor more xDDDDD he teach the main use to make some falls for him Its so cut,unrelated,,Falls,neutral,0,129469475,yunjae_9095,4852,397,4399,12.22,104696,0,\u2665\u2661 TVXQ and JYJ \u2605\u2606\u2605\u2606\u2605 I love my daffa (\u0283\u01aa\xb4\u25bd`)\u2665 No Stans Plz!! KEEP CALM AND SHIP YUNJAE! \u2764vixx RaBin @prettyhongbin \u2764 Dp. cr. jejungyumi \u2764,public
me limbs to the top of mt everett me yells RICHONNE me falls to my knees,unrelated,,Falls,negative,-0.913527,110455733,saddiebutbaddie,9901,361,38967,27.4265928,81740,0,"\u2727\uff9f:* lover of good vibes, good music, and the stars *:\uff9f\u2727",public
Its always the one who falls first hurts most,unrelated,,Falls,negative,-0.902756,560043116,JoeyJaycey,504,277,2561,1.819494585,21323,0,\u2728WMH,public
of Construction Spending Walls 0 5 in February expertraders forexcoaching fore street forexnews forestry,unrelated,,Falls,neutral,0,3069714055,expertraders,198,0,0,198,77543,0,\u2748Expertraders Team \u2748Forex Trader & Coacher \u2748Millionaire To Be \u2748Established in 2010 \u2748+60148349432 \u275dEverything you need is in the candle itself\u275e,businesses
Brawls into bed with wearing nothing at all and falls asleep on his arms,unrelated,,Falls,negative,-0.898557,7.03E+17,_Fiery_Archer_,126,117,142,1.076923077,440,0,"\u275dIf ye hud a chance tae chaynge yer fate, wid ye?\u275e {#Disney} {#BigFour} {#OUAT} {#RP} {18+} {#Mericcup} \u275dMah chief: @UpTheAwkward.\u275e",public
I hate when my leg foot falls asleep I can t walk for like 15 minutes,unrelated,,Falls,negative,-0.931025,132378456,Hannah_Bokor,674,349,47494,1.931232092,37542,0,\u27b5 virGo \u21de\u263e,public
i lost my sister to stomach cancer so i am very passionate about helping pp understand the importance of eating healthy amp natural foods,educational,,Stomach cancer,positive,0.404695,4232392888,__PrettyREAL,433,398,223,1.09,3251,0,\u2800\u2800\u2800\u2800\u2800\u2800\u2800\u2800Spirituality is God given\u2800\u2800\u2800\u2800 \u2800\u2800\u2800\u2800\u2800\u2800\u2800MELANIN LOVE | 1 9 9 0 | \u2800\u2800\u2800\u2800 \u2800 \u2800 \u2800| I AM BLACK QUEEN |,public
Gravity In Reverse Walls That about you,unrelated,,Falls,positive,0.548848,4797948955,ItsPacifica,1034,884,933,1.17,2199,0,\u3010 Northwest/Gleeful/Pines \u2022 Flirty \u2022 RP \u2022 #GravityFalls \u2022 #GravityRises \u2022 #ReverseFalls \u2022  #OpenRp \u3011,public
of WITH of RELEASE it Now In Pale it abstract Monogram it Now In Pale it HIS STATUE FALLS POLAR,unrelated,,Falls,negative,-0.817959,599813065,gowithmejapan,4090,3541,1297,1.155040949,36622,1,\u3010GO WITH ME RECORDS\u3011\u90a6\u697d\u3001\u6d0b\u697d\u4f9b\u306b\u4e16\u754c\u4e2d\u306e\u7d20\u6674\u3089\u3057\u3044\u30a2\u30fc\u30c6\u30a3\u30b9\u30c8\u3092\u7d39\u4ecb\u3067\u304d\u308c\u3070\u5e78\u3044\u3067\u3059\u2605,public
Your falls in a weekend I love the Philippines AliwFalls TalayFalls HiddenFalls HuluganFalls All found in,unrelated,,Falls,neutral,0,260640304,maria_manila,20983,21802,0,0.96,121050,0,\u304a\u3068\u3055\u3093\u65e5\u672c\u4eba\u3067\u884c\u65b9\u4e0d\u660e\u3002\u304a\u304b\u3055\u3093\u30d5\u30a3\u30ea\u30d4\u30f3\u4eba\u3067\u75c5\u6c17\u3002\u76f8\u4e92\u30d5\u30a9\u30ed\u30fc\uff11\uff10\uff10\uff05\u3067\u3059\u3002\r\n \uff5c http://t.co/4CVDgPzflL,public
It is diabetes tounyoubyoudesu There is a chronic disease jibyougaarimasu ConveythediseaseinJapanese,educational,,Diabetes,negative,-0.873361,116181465,tokaov,1192,5000,46604,0.24,253836,0,\u3068\u304b\u3092\u3075\u3002\u6ca2\u7009\u3001\u30aa\u30e2\u30c0\u30ab\u79d1\u3002\u6328\u62f6\u306f\u6c5f\u6238\u4ed5\u8349\u3002\u307e\u3041\u3001\u5fc3\u3092\u75c5\u3093\u3067\u3044\u3066\u3082\u666e\u901a\u306b\u793e\u4f1a\u751f\u6d3b\u306f\u9001\u308c\u308b\u3088\u3002\u672c\u4eba\u306b\u305d\u306e\u6c17\u304c\u3042\u308c\u3070\u3002\r\n\u30ea\u30d7\u3001\u3064\u3063\u3053\u307f\u7b49\u304a\u6c17\u8efd\u306b\u3069\u305e\u3002\r\nskypeID:tokaov\r\nhttp://t.co/uu6jnWdb\r\n\u6a2a\u9808\u8cc0\u93ae\u5b88\u5e9c\u30d2\u30da\u30ea\u30aa\u30f3\u8266\u968a\u53f8\u4ee4\u90e8,public
National American Diabetes Association Alert May,promotional,,Diabetes,neutral,0,7.55E+17,utcall,29,49,56,0.59,360,0,\u3068\u3063\u304f\u306e\u6614\u306b\u6210\u4eba\u6e08\u307f\u2506\u3068\u3046\u3089\u3076\u57a2(2.5\u8a71\u984c\u542b)\u2506\u5922\u898b\u304c\u3061\u306a\u96d1\u98df\u3067\u3059\u2026\u2026\u2506\u5200\u30df\u30e5\u79cb\u516c\u6f14\u5927\u962a\u30fb\u51f1\u65cb\u4e88\u5b9a,public
National American Diabetes Association Alert May,promotional,,Diabetes,neutral,0,7.55E+17,utcall,29,49,56,0.59,360,0,\u3068\u3063\u304f\u306e\u6614\u306b\u6210\u4eba\u6e08\u307f\u2506\u3068\u3046\u3089\u3076\u57a2(2.5\u8a71\u984c\u542b)\u2506\u5922\u898b\u304c\u3061\u306a\u96d1\u98df\u3067\u3059\u2026\u2026\u2506\u5200\u30df\u30e5\u79cb\u516c\u6f14\u5927\u962a\u30fb\u51f1\u65cb\u4e88\u5b9a,public
Migraine of flare up And just had a panic attack Yeah I m not feeling today,personal,,Migraine,negative,-0.880674,50162131,XoMaddieUoX,96,179,8022,0.536,11288,0,\ube45\uc2a4\ud0c0~ Paramore~ Halfnoise~ 94 line ^^// part time model and seamstress,public
I just fucking love how I can get an asthma attack so easily Tucking love it One,personal,,Asthma,neutral,0,43751857,ItsJessyLopez,1105,2548,72185,0.434,22813,0,\xb0| Los Angeles | Pluz Zize | Lamesphotos\xa9 | LGBTQI+ | Internet | Video Games: #MostOP |\xb0 buz: itsjessylopez@gmail.com,public
I get stuck with a needle every few months to make sure I wasn t exposed to tuberculosis But like what happens if i were nurse,personal,,Tuberculosis,negative,-0.701359,330087372,schick__happens,486,520,16682,0.934615385,9231,0,____boston address_long island accent____ \u2022corinthians 13:4-8\u2022,public
I told By when she was 4 that the Sioux Walls Too burnt down and all the animals died so I didn t have to take her By aunt,unrelated,,Falls,negative,-0.848681,259489120,Keeleigh1203,543,339,6532,1.6,6272,0,"{lll\u2022XVI} Senior studying Athletic Training at the University of Northern Iowa from Sioux City, IA #GoPanthers #UNIFight",public
